DegreeInstitutionName,DegreeInstitutionId,CountryName,CountryId
Hanoi University of Science and Technology,558087.0,Vietnam,193
"Institute of Physics, Hanoi, Vietnam",558232.0,Vietnam,193
"Ho Chi Minh City University, Vietnam",555254.0,Vietnam,193
University of Saigon,557215.0,Vietnam,193
University College Galway,542009.0,Ireland,82
Dublin City University,547656.0,Ireland,82
University College Dublin,542688.0,Ireland,82
Maynooth University,622060.0,Ireland,82
University of Ireland,555598.0,Ireland,82
Trinity College Dublin,559996.0,Ireland,82
University of Limerick,557657.0,Ireland,82
Technological University Dublin (TU Dublin),622061.0,Ireland,82
Queen's University Belfast,537907.0,Ireland,82
National University of Ireland,539092.0,Ireland,82
"University College, Cork, Ireland",538039.0,Ireland,82
Qingdao University,633934.0,China,36
"Nanjing Normal University, China",558586.0,China,36
Chinese Academy of Sciences,538068.0,China,36
"Graduate School of Chinese Academy of Agriculture Science, Beijing, Chin",549737.0,China,36
University of Hong Kong,542769.0,China,36
Zhejiang University of Technology,558910.0,China,36
China Agricultural University,557415.0,China,36
Inner Mongolia University,621223.0,China,36
"China University of Geosciences, Wuhan",555898.0,China,36
Weifang Medical University,634064.0,China,36
Bejing Institute of Radiation Medicine,541415.0,China,36
Zhengzhou University,558644.0,China,36
Shandong University,541448.0,China,36
Central Academy of Fine Arts,545722.0,China,36
Zhejiang Agriculture and Forestry University,618460.0,China,36
"Institute of Metal Research, Chineses Academy of Sciences",604294.0,China,36
"National Vaccine and Serum Institute, Beijing",551980.0,China,36
South China Agricultural University,540080.0,China,36
Yanshan University,560082.0,China,36
Shanghai University,544466.0,China,36
Nanjing Tech University,622203.0,China,36
"Institute of Zoology, Chinese Academy of Sciences",604307.0,China,36
Shanghai Jiao Tong University,539391.0,China,36
"Institute of Physics, Chinese Academy of Sciences",621607.0,China,36
Shanghai University of Traditional Chinese Medicine,549301.0,China,36
South China Normal University,558150.0,China,36
"Beijing Institute for Biotechnology, China",555808.0,China,36
Shandong Agricultural University,559315.0,China,36
Shanxi University,633948.0,China,36
"Shanghai Institute of Optics and Fine Mechanics, CAD",557339.0,China,36
Southwest Jiaotong University,557600.0,China,36
"Institute Of Genetics, Beijing",556205.0,China,36
Beijing University of Posts and Telecommunications,558850.0,China,36
Chinese Academy of Social Sciences,539247.0,China,36
Henan University,622285.0,China,36
Wenzhou Medical University,558767.0,China,36
Changchun University,673245.0,China,36
"National Institute of Biological Science, Beijing",630784.0,China,36
Inner Mongolia Medical University,651719.0,China,36
Donghua University,546082.0,China,36
Guangxi Medical University,558558.0,China,36
"Northeast Forestry University, China",557972.0,China,36
Beijing Jiaotong University,559755.0,China,36
Chinese Academy of Medical Sciences,608343.0,China,36
Zunyi Medical College,557331.0,China,36
"Sichuan College Of Animal Science And Veterinary Medicine, Sichuan",556841.0,China,36
Tianjin University of Science and Technology,633962.0,China,36
Hangzhou Normal University,633854.0,China,36
"Fujian Agriculture and Forestry University, China",557803.0,China,36
"Institute of Mathematics, Beijing",556220.0,China,36
Nanchang University,559188.0,China,36
Southwest Medical University,625241.0,China,36
University of Shihezi,554772.0,China,36
Shanghai Institute of Materia Medica,548457.0,China,36
Beijing Institute of Pharmacology,551055.0,China,36
"Institute of Geology, Beijing",556209.0,China,36
Beijing Capital Medical University,555050.0,China,36
Yunyang Medical College,553613.0,China,36
"Southern Medical University, China",557842.0,China,36
"Institute of Biochemistry and Cell Biology, Chinese Academy of Sciences",650687.0,China,36
Guangzhou Medical University,559353.0,China,36
Hengyang Medical College,555249.0,China,36
Norman Bethune University.,552191.0,China,36
"Beijing Institute of Technology, China",557948.0,China,36
Shanghai Institute of Entomology,544619.0,China,36
"North China Coal Medical University, Tangshan, China",556603.0,China,36
"Nan Hua University Medical School, China",558128.0,China,36
Shanghai Institute of Microsystem and Information Technology,552347.0,China,36
"Institute Of Genetics Academia Sinica, China",556201.0,China,36
Peking Light Industry College,556653.0,China,36
Chinese Academy of Agricultural Sciences,554546.0,China,36
"North Sichuan Medical School, China",557876.0,China,36
North China Electric Power University,550232.0,China,36
"Institute of Photographic Chemistry, Chinese Academy of Sciences",556249.0,China,36
Shantou University Medical College,556830.0,China,36
Nantong University,633910.0,China,36
Central China Normal University,555876.0,China,36
Bengbu Medical College,558629.0,China,36
"Wuhan University of Hydraulic and Electric Engineering, China",551344.0,China,36
"Southwest Agricultural University, China",556866.0,China,36
Tongji University,556996.0,China,36
University of Shanghai for Science and Technology,634047.0,China,36
Shanghai Institute of Pharmaceutical Industry,558148.0,China,36
Ocean University of China,558940.0,China,36
Xinjiang Medical College,555690.0,China,36
China Academy of Engineering Physics,641895.0,China,36
Shanghai Institute of Technical Physics,556825.0,China,36
Xinxiang Medical College,555691.0,China,36
"China University of Mining and Technology, China",555899.0,China,36
Xi'an Institute of Optics & Precision Mechanics,539604.0,China,36
"Shenyang Agricultural University, Shenyang",556832.0,China,36
"East China Normal University, Shanghai, China",557953.0,China,36
University of Electronic Science and Technology of China,558168.0,China,36
"Northeastern University, China",558593.0,China,36
"Institute of Geology and Geophysics, China",556208.0,China,36
City University of Hong Kong,544841.0,China,36
General Research Institute for Non-Ferrous Metals,628927.0,China,36
Renmin University of China,558904.0,China,36
"South China University Of Tropical Agriculture, Hainan",556854.0,China,36
Xi'an Medical University,678571.0,China,36
Wuhan University,538933.0,China,36
Tongji Medical University,539087.0,China,36
Fudan University,538144.0,China,36
Tsinghua University,538408.0,China,36
Peking Union Medical College,538041.0,China,36
Peking University,539162.0,China,36
"Dalian Institute of Chemical Physics, China",557426.0,China,36
"Institute of Biophysics, Chinese Academy of Sciences",556173.0,China,36
"Institute of Neuroscience, Chinese Academy of Sciences",556238.0,China,36
Chinese University of Hong Kong,546450.0,China,36
Jilin University,539078.0,China,36
Nankai University,538006.0,China,36
"Shanghai Institute of Plant Physiology, Chinese Academy of Science",556824.0,China,36
Nanjing University of Science and Technology,538078.0,China,36
Tianjin University,540502.0,China,36
Zhejiang University,539652.0,China,36
Nanjing University,542479.0,China,36
Xiamen University,539882.0,China,36
"Fourth Military Medical University, China",556006.0,China,36
"Anhui Medical University, Hefei",555767.0,China,36
"Beijing Institute of Pharmacology and Toxicology, China",555809.0,China,36
"Southeast University, China",538920.0,China,36
Hunan Medical University,546734.0,China,36
"Hunan University, China",557874.0,China,36
University of Science and Technology of China,539490.0,China,36
"Henan Medical University, Henan, China",556078.0,China,36
Lanzhou University,539040.0,China,36
Hong Kong University of Science and Technology,545221.0,China,36
Harbin Institute of Technology,539616.0,China,36
Xian Jiaotong University,545110.0,China,36
Shanghai Medical Education,556827.0,China,36
"West China University of Medical Sciences, China",557299.0,China,36
"East China University of Science and Technology, Shanghai",557952.0,China,36
Xidian University,538715.0,China,36
"Jinan University, China",556313.0,China,36
"Institute of Atmospheric Physics, China",556162.0,China,36
Nanjing Agricultural University,539475.0,China,36
Beijing Normal University,557403.0,China,36
Wuhan University of  Technology,545317.0,China,36
Fujian Medical University,554570.0,China,36
"Shanghai Institute of Biochemistry, Shanghai",549531.0,China,36
Nanjing Forestry University,556518.0,China,36
Beihang University,557402.0,China,36
"Shanghai Institute of Physiology, Chinese Academy of Sciences",557589.0,China,36
Beijing Medical University,541209.0,China,36
"Northwest Agricultural and Forestry University, China",556610.0,China,36
Chongqing Medical University,547025.0,China,36
"Chinese Center for Disease Control and Prevention, China",555901.0,China,36
"Third Military Medical University, China",556985.0,China,36
"Academia Sinica, Beijing",546396.0,China,36
"Suzhou Medical College, China",556934.0,China,36
Dalian University of Technology (China),553597.0,China,36
"Norman Bethune University of Medical Sciences, China",556601.0,China,36
"Hubei Medical University Xianning Medical School, China",556097.0,China,36
Jiangnan University,542975.0,China,36
Huazhong University of Science and Technology,550708.0,China,36
"Sichuan University, China",540406.0,China,36
China Medical University,540983.0,China,36
Second Military Medical University,554291.0,China,36
Xuzhou Medical College,554785.0,China,36
"South China University of Technology, China",544439.0,China,36
Institute of Genetics and Chinese Academy of Sciences,556203.0,China,36
"Huazhong Agricultural University, China",556096.0,China,36
Sun Yat-sen University,539602.0,China,36
"Changchun Institute Of Applied Chemistry, China",555889.0,China,36
"Chongqing University, China",557721.0,China,36
"Harbin Medical University, China",556070.0,China,36
"Lanzhou Institute of Chemical Physics, Lanzhou ,China",556381.0,China,36
Hong Kong Polytechnic University,557466.0,China,36
"Capital University of Economics and Business, Beijing",558885.0,China,36
Tianjin Medical University,543429.0,China,36
"Nanjing Medical University, Nanjing ,China",556519.0,China,36
Hong Kong Baptist University,556091.0,China,36
"Guangzhou University of Chinese Medicine, P.R. China",556061.0,China,36
Shanghai Institute of Cell Biology,557588.0,China,36
"China Pharmaceutical University, Nanjing, China",555897.0,China,36
"Shanghai Medical School , Shanghai, China",556828.0,China,36
"Northwestern Polytechnical University,China",557552.0,China,36
"Institute of Virology, Chinese Academy of Preventive Medicine, China",556276.0,China,36
Dalian Medical University,548433.0,China,36
Shanghai Institutes for Biological Sciences,557590.0,China,36
Shanghai Institute,542824.0,China,36
Central South University,547910.0,China,36
Chinese Academy of Preventative Medicine,558075.0,China,36
"Shenyang Pharmaceutical University, China",556833.0,China,36
Academy of Military Medical Sciences,541083.0,China,36
University of Chinese Academy of Sciences,544996.0,China,36
"Kunming Medical College, China",556367.0,China,36
"Taishan Medical College, China",556942.0,China,36
Hunan Normal University,558853.0,China,36
Xian Medical University,543963.0,China,36
Shanghai Institute of Organic Chemistry,556823.0,China,36
Hebei Medical University,542349.0,China,36
"Shanxi Medical University, China",557822.0,China,36
"Soochow University, China",557597.0,China,36
Shanghai Brain Research Institute,554700.0,China,36
Zhejiang Medical University,552880.0,China,36
Shanghai Institute of Ceramics,556822.0,China,36
Xiang-Ya Medical College,557322.0,China,36
"Wannan Medical College, China",557832.0,China,36
Samara State Technical University,557740.0,Russia,145
"State Hydrological Institute, Saint Petersburg",556905.0,Russia,145
"Institute of Cytology and Genetics, Novosibirsk, Russia",554595.0,Russia,145
ITMO University,558936.0,Russia,145
"Institute of Applied Mathematics, Moscow",556161.0,Russia,145
Leningrad Electrotechnical University,545114.0,Russia,145
"Leningrad Pedagogical Institute, USSR",556390.0,Russia,145
Institute of Cell Biophysics,557478.0,Russia,145
Leningrad Nuclear Physics Institute,545868.0,Russia,145
"Institute of Catalysis, Novosibirsk (USSR)",555277.0,Russia,145
Central Institute of Physical Culture (Russia),541613.0,Russia,145
University of Kazan,543335.0,Russia,145
"National Research Center of Antibiotics, Moscow",546789.0,Russia,145
Institute of Experimental Meteorology,556196.0,Russia,145
Leningrad Pediatric Medical Institute,556391.0,Russia,145
"Buryate State Agricultural Academy, Ulan-Uden, Russia",555846.0,Russia,145
U.S.S.R. Academy of Sciences,538053.0,Russia,145
Marine Hydrophysical Institute,556436.0,Russia,145
"State Land Organization University, Moscow",556907.0,Russia,145
"Institute for Genetics and Selection of Industrial Microorganisms, Mosco",557988.0,Russia,145
"Tver State University, Tver",557007.0,Russia,145
Baltic State Technical University,558052.0,Russia,145
Gorky State University,558019.0,Russia,145
"Research Institute of Applied Physics, Moscow",556717.0,Russia,145
"Institute for Transplantation and Artificial Organs, Moscow",556151.0,Russia,145
Moscow Institute of Theoretical and Experimental Physics,556495.0,Russia,145
Academy of Medical Sciences Moscow,538099.0,Russia,145
Moscow Medical Stomatologic Institute,556496.0,Russia,145
St-Petersburg Marine Technical University,540344.0,Russia,145
Steklov Institute of Mathematics,556929.0,Russia,145
"Institute Of Theater, Leningrad",556270.0,Russia,145
Russian Academy of Sciences,557477.0,Russia,145
Leningrad Institute of Nuclear Physics,541371.0,Russia,145
Nizhny Novgorod Technical University,556600.0,Russia,145
"Moscow Automobile and Highway Technology Institute, Moscow, Russia",544683.0,Russia,145
Institute of Mathematics and Mechanics of the Russian Academy of Science,551665.0,Russia,145
"Institute of Mathematics, USSR",556223.0,Russia,145
"Institute of Experimental Medicine, St. Petersburg, Russia",556195.0,Russia,145
Kirov State Technological University,549599.0,Russia,145
St Petersburg State University,556882.0,Russia,145
"Russian State University,",545759.0,Russia,145
Frumkin Institute of Electrochemistry,556015.0,Russia,145
Far Eastern Federal University,622084.0,Russia,145
"Institute for Control Sciences, Moscow",556130.0,Russia,145
"Institute of Immunology, Moscow, Russia",556211.0,Russia,145
Plekhanov Institute of the National Economy,541207.0,Russia,145
Institute of Cytology of Russian Academy of Sciences,550596.0,Russia,145
"Inst. Of Spectroscopy, Ussr",556117.0,Russia,145
Kazan Federal University,621571.0,Russia,145
"Institute of the Physics of the Earth, Moscow",556269.0,Russia,145
"N.F. Gamaleya Epidemiology & Microbiology Institute, Moscow, Russia",556513.0,Russia,145
"Pavlov Institute of Physiology, Russian Academy of Sciences, St. Petersb",554235.0,Russia,145
Krasnodar Polytechnic Institute,540740.0,Russia,145
Peter the Great St Petersburg Polytechnic University,622093.0,Russia,145
Voronezh State University,557288.0,Russia,145
"Zhukovsky Air Force Engineering Academy, Moscow",540118.0,Russia,145
Moscow State Mining University,555393.0,Russia,145
USSR Academy of Medical Sciences Institute of Medical Genetics,544807.0,Russia,145
Agrophysical Research Institute,543751.0,Russia,145
"Institute of Pharmacology, Moscow, Russia",560111.0,Russia,145
Moscow University,539397.0,Russia,145
Krasnoyarsk State University (Russia),559850.0,Russia,145
Novosibirsk Institute of Organic Chemistry,556621.0,Russia,145
Pushchino State University,556699.0,Russia,145
Russian Research Center,540840.0,Russia,145
IP Pavlov Leningrad Medical University,556298.0,Russia,145
Moscow Institute of Biomedical Sciences,558124.0,Russia,145
Moscow State University,675522.0,Russia,145
Saint Petersburg University,618839.0,Russia,145
Pirogov Russian National Research Medical University,558247.0,Russia,145
"Karpov Institute of Physical Chemistry, Moscow, Russia",556337.0,Russia,145
Southern Federal University,622098.0,Russia,145
Institute of Foundations and Underground Structure,556199.0,Russia,145
Boreskov Institute of Catalysis,557408.0,Russia,145
"Institute of Normal Physiology, Moscow",556239.0,Russia,145
Moscow State Institute of Theatre Art,538831.0,Russia,145
Arctic and Antarctic Research Institute,542164.0,Russia,145
Russian State Hydrometeorological University,542471.0,Russia,145
Technical Institute of Lenigrad,556951.0,Russia,145
Institute Theoretical and Experimental Biophysics,557484.0,Russia,145
Moscow State Engineering Physics Institute,556500.0,Russia,145
"General Physics Institute, Moscow",542897.0,Russia,145
Siberian State Medical University,554701.0,Russia,145
Tomsk Polytechnic Institute,556994.0,Russia,145
Novosibirsk Institute of Nuclear Physics,555441.0,Russia,145
University of Voronezh,542356.0,Russia,145
"People's Friendship University, Moscow",554664.0,Russia,145
V.M. Bekhterev Psychoneurological Institute,557273.0,Russia,145
"Institute of Biomedical Problems, Moscow",556169.0,Russia,145
Bashkir State University,541782.0,Russia,145
State Optical Institute,556910.0,Russia,145
Russian University,553243.0,Russia,145
Moscow Institute of Psychology,556493.0,Russia,145
Herzen State Pedagogical University,556080.0,Russia,145
Leningrad Electrical Engineering Institute,539214.0,Russia,145
Moscow Institute for Protein Research,545359.0,Russia,145
"Novosibirsk Institute of Semiconductor Physics, USSR Academy of Sciences",541276.0,Russia,145
"Physical-Technical Institute, St. Petersburg (Russia)",555467.0,Russia,145
Mendeleev Institute of Metrology ( Russian NIST),557524.0,Russia,145
Institute of Terrestrial Magnetism,557482.0,Russia,145
"Institute of Precision Mechanics and Computer Technology, Moscow",556257.0,Russia,145
"Institute of Applied Geophysics, Moscow",556160.0,Russia,145
Izevskij Medical Institute,557489.0,Russia,145
Petrov Cancer Research Institutes Petersburg,556661.0,Russia,145
GIRICOND Science & Research Institute,546066.0,Russia,145
Institute for Physics and Power Engineering,557473.0,Russia,145
Altai State University,555751.0,Russia,145
Moscow Institute Of Power Engineering,627805.0,Russia,145
Institute of Philosophy of Russian Academy of Sciences,545746.0,Russia,145
"Institute for Physiology, USSR Academy of Science",556142.0,Russia,145
"National Mental Health Research Center, Moscow",556547.0,Russia,145
Russian Research Center for Molecular Diagnostics and Therapy,556753.0,Russia,145
Institute for Genetics and Microorganisms,557471.0,Russia,145
Dagestan Medical Academy,557425.0,Russia,145
Moscow Institute of Electronic Engineering,542039.0,Russia,145
"Institute for Linguistics, Russian Academy of Sciences",556133.0,Russia,145
Institute of Microbiology - USSR Academy of Science,556228.0,Russia,145
Taganrog Institute for Radio Technology,556941.0,Russia,145
All-Russian Geological Research Institute,553540.0,Russia,145
"Medical Academy, St. Petersburg, Russia",556456.0,Russia,145
Leningrad Conservatory,539019.0,Russia,145
Novosibirsk Institute of Cytology and Genetics,556620.0,Russia,145
Russian Orthodox Theological Seminary and Academy,547548.0,Russia,145
Academy of Sciences of Russia,552926.0,Russia,145
North Ossetian State Medical Academy,540798.0,Russia,145
"National Institute of Hydrogeology and Engineering Geology, Moscow, USSR",557955.0,Russia,145
Moscow State Linguistic University,556501.0,Russia,145
Moscow State Academy of Fine Chemical Technology,556498.0,Russia,145
Saratov State University,556779.0,Russia,145
"Institute for High Energy Physics, Protvino, Russia",558893.0,Russia,145
"Central Aerological Observatory, Moscow",555875.0,Russia,145
"the Radiophysical Research Institute(Nizhny Novgorod, Russia)",541970.0,Russia,145
Institute of Mathematics of Russian Academy of Sciences,556219.0,Russia,145
Institute For US And Canada Studies,556152.0,Russia,145
Institute of Chemical Kinetics and Combustion,558093.0,Russia,145
"Institute of Geography, Soviet Academy of Sciences, Moscow",556207.0,Russia,145
Tomsk State University,556995.0,Russia,145
"Institute of Chemical Industry, Moscow",558710.0,Russia,145
"Ivanovsky Institute of Virology, Moscow",553627.0,Russia,145
Tambov Chemical Machine Design Institute,556945.0,Russia,145
Research Institute for Applied Microbiology,556716.0,Russia,145
"Koltzov Institute of Developmental Biology, Moscow, Russia.",550300.0,Russia,145
Kuban State University,541379.0,Russia,145
Moscow Institute for Physics and Technology,542147.0,Russia,145
Kazan State Pedagogical University,555318.0,Russia,145
Tomsk State University and St.-Petersburg State University,548162.0,Russia,145
"Moscow Medical Academy, Russian Federation",557530.0,Russia,145
Institute of Numerical Mathematics Russian Academy of Sciences,554602.0,Russia,145
"Institution of Medical Genetics, Moscow",556280.0,Russia,145
Moscow Institute of Genetics and Selection of Microorganisms,554057.0,Russia,145
Institute of Protein Research Russian Academy of Sciences,556260.0,Russia,145
"Institute for Continuing Education of Physicians, St. Petersburg, Russia",556129.0,Russia,145
Moscow Power Engineering Institute,557531.0,Russia,145
Moscow Institute of Steel and Alloys,541631.0,Russia,145
"Academy of Sciences, St. Petersburg",555726.0,Russia,145
"Institute of High Temperatures, Ussr Academy of Sciences",554599.0,Russia,145
Chelyabinsk State Technical University,542500.0,Russia,145
Sechenov Medical Academy,558645.0,Russia,145
"Institute of Toxicology, St. Petersburg",556273.0,Russia,145
national University of Science and Technology (MISIS)Moscow,556567.0,Russia,145
University of St. Petersburg,549164.0,Russia,145
"Institute of Semiconductor Physics, Akademgorodok",556263.0,Russia,145
State Research Center of Virology And Biotechnology,554711.0,Russia,145
"Institute of Biological Physics, Pushchino",556168.0,Russia,145
Smolensk State Medical Academy,554703.0,Russia,145
Moscow Aviation Institute,549395.0,Russia,145
Moscow Conservatory,556499.0,Russia,145
Institute of Biochemical Physics of Russian Academy of Scienc,546425.0,Russia,145
Federal Institute of Hematology and Blood Transfusion,558083.0,Russia,145
"Institute of Physics, Baku, USSR",555295.0,Russia,145
LOMI Mathematics Institute,543929.0,Russia,145
Leningrad Institute of Experimental Medicine Academy of Medical Science,556389.0,Russia,145
Petrov Research Institute.,540146.0,Russia,145
Polymer Engineering Science from USSR Academy of Sciences,541794.0,Russia,145
Pushkin Institute,557566.0,Russia,145
Saint Petersburg State Pediatric Medical University,625628.0,Russia,145
"Technological University, Moscow",539746.0,Russia,145
USSR Academy of Sciences,541439.0,Russia,145
First Moscow State Medical University,556003.0,Russia,145
Lomonosov Moscow State University,539292.0,Russia,145
Engelhardt Institute of Molecular Biology,543302.0,Russia,145
Moscow Institute of Physics and Technology,538189.0,Russia,145
"Ioffe Institute of Physics and Technology, Leningrad",556297.0,Russia,145
Lebedev Physical Institute,540380.0,Russia,145
Joint Institute for Nuclear Research,552187.0,Russia,145
Leningrad State University,541540.0,Russia,145
"Sobolev Institute of Mathematics, Novosibirsk",556852.0,Russia,145
"Institute of Chemical Physics, Russian Academy of Sciences, Moscow",556178.0,Russia,145
Moscow Institute,555390.0,Russia,145
Moscow State Pedagogical University,540970.0,Russia,145
Saint Petersburg State University,539502.0,Russia,145
"Landau Institute for Theoretical Physics, Moscow",556380.0,Russia,145
Sechenov Institute of Evolutionary Physiology and Biochemistry,556812.0,Russia,145
Institute of Solid State Physics of Russian Academy of Science,556266.0,Russia,145
Kurchatov Institute,543851.0,Russia,145
Kurnakov's Institute,538688.0,Russia,145
Novosibirsk State University,557555.0,Russia,145
"Institute for Theoretical and Experimental Physics, Moscow",556149.0,Russia,145
"St. Petersburg State Technical University, St. Petersburg, Russia",556898.0,Russia,145
"Computing Center of the Academy of Sciences, Moscow, Russia",538402.0,Russia,145
Kazan State Medical University,555317.0,Russia,145
"Budker Institute of Nuclear Physics, Novosibirsk",555843.0,Russia,145
"Institute for Nuclear Research, Moscow",556137.0,Russia,145
Bach Institute of Biochemistry Moscow,541374.0,Russia,145
Mechanical Engineering Research Institute of Russian Academy of Sciences,543992.0,Russia,145
"Zoological Institute, Academy of Science, St. Petersburg, Russia",541236.0,Russia,145
"Institute of Steel and Alloys, Moscow",556268.0,Russia,145
Russian Cancer Research Center,557577.0,Russia,145
"Institute of Molecular Genetics, Moscow",556236.0,Russia,145
Shirshov Institute of Oceanology,540736.0,Russia,145
"Moscow Engineering Physics Institute, Moscow",556491.0,Russia,145
"Kapitza Institute for Physical Problems, Moscow",556330.0,Russia,145
"Institute of Crystallography, Moscow",556187.0,Russia,145
USSR - Free-Standing Inst,546141.0,Russia,145
"Nizhny Novgorod State University, Nizhny Novgorod",556599.0,Russia,145
Ural State University,545592.0,Russia,145
"Russian Space Research Institute, Moscow, Russia",556754.0,Russia,145
"Institute of Biology, Russian Academy of Sciences",539085.0,Russia,145
"Pulkova Observatory, St. Petersburg",556696.0,Russia,145
Academy of Medical Sciences of the USSR,615103.0,Russia,145
St. Petersburg State Conservatory,556895.0,Russia,145
"Gabrichevsky Research Institute of Epidemiology and Microbiology, Moscow",556019.0,Russia,145
"Kirensky Institute of Physics, Krasnoyarsk",556357.0,Russia,145
"Arkhangelsk Medical Institute, Arkhangelsk",555777.0,Russia,145
Leningrad Polytechnic Institute,542806.0,Russia,145
Bauman Moscow State Technical University,558057.0,Russia,145
"VNII Genetika, Moscow",557286.0,Russia,145
Ivanova state university,549330.0,Russia,145
St. Petersburg Institute of Technology,556893.0,Russia,145
USSR - Non-Medical School,546133.0,Russia,145
"Russian Academy of Medical Science, Moscow",557940.0,Russia,145
